[@dennisbyington](https://github.com/dennisbyington) 08/24/2022 17:45:32

![Screen Shot 2022-08-24 at 12 40 41 PM](https://user-images.githubusercontent.com/106843224/186487235-97a336db-264e-4f5f-aeb5-7fc43192a93d.png)

-----------
[@kcl1s](https://github.com/kcl1s) 08/11/2022 18:55:00

![image](https://user-images.githubusercontent.com/13920899/184217488-3a84fd68-cca5-4b5d-92fa-4af9a2e5a67d.png)

-----------
[@pithoner](https://github.com/pithoner) 07/30/2022 01:07:47

![image](https://user-images.githubusercontent.com/109999434/181864216-3c27c3d4-ab66-4e70-bc22-cee0d89cbd3d.png)

![image](https://user-images.githubusercontent.com/109999434/181864251-73a19926-9e20-439f-8305-f38fa7f4db93.png)

-----------
[@PySimpleGUI](https://github.com/PySimpleGUI) 07/10/2022 06:13:54

![image](https://user-images.githubusercontent.com/46163555/178133600-e5632037-dd45-4d4e-9a0d-89f09cea3156.png)

![image](https://user-images.githubusercontent.com/46163555/178133586-fa0d500e-cf28-4c22-a640-c5cbc881b336.png)

-----------
[@schlopp96](https://github.com/schlopp96) 06/27/2022 04:35:24

![PyFiTransfer-GUI](https://user-images.githubusercontent.com/71921821/175860724-ff7509f6-5dd6-4ca4-8b0b-0c996abdaf4e.png)

![v2mp3_gui](https://user-images.githubusercontent.com/71921821/175860751-10d818cf-2141-49b7-87ad-b031fa3d8063.png)

-----------
[@jerrylususu](https://github.com/jerrylususu) 06/23/2022 13:05:19

![screenshot](https://user-images.githubusercontent.com/17522475/175305470-a53b628f-664d-4056-8f7a-760ecc2b1ce3.png)

-----------
[@PySimpleGUI](https://github.com/PySimpleGUI) 06/20/2022 16:42:25

![image](https://user-images.githubusercontent.com/46163555/174646737-d96c02d9-9488-4865-8dcf-514a045cf902.png)

-----------
[@ArchKubi](https://github.com/ArchKubi) 06/20/2022 16:22:36

![2022-06-20-192110_1280x1012_scrot](https://user-images.githubusercontent.com/80429360/174644113-3047c3e0-19e8-4e9e-8db5-30691034f002.png)

![2022-06-20-192226_1280x1012_scrot](https://user-images.githubusercontent.com/80429360/174644255-dc4ccebc-6c0c-4d82-a9a7-7fd82b14669b.png)

-----------
[@PySimpleGUI](https://github.com/PySimpleGUI) 06/20/2022 11:28:20

![image](https://user-images.githubusercontent.com/46163555/174591871-98e15211-357a-46a1-9561-d9df94dfedee.png)

-----------
[@ArchKubi](https://github.com/ArchKubi) 06/18/2022 12:50:10

![2022-06-18-154942_231x272_scrot](https://user-images.githubusercontent.com/80429360/174438406-20826100-f0fa-48df-b364-613012b7f9a8.png)

-----------
[@ArchKubi](https://github.com/ArchKubi) 06/15/2022 10:41:07

![2022-06-15-134050_1280x1012_scrot](https://user-images.githubusercontent.com/80429360/173808409-20812eb8-c343-4af6-96b6-8469924e7acd.png)

-----------
[@ArchKubi](https://github.com/ArchKubi) 06/13/2022 11:49:29

![2022-06-13-144526_70x268_scrot](https://user-images.githubusercontent.com/80429360/173346970-545de9ca-3049-4072-9fb5-a3e959ac860c.png)

-----------
[@PySimpleGUI](https://github.com/PySimpleGUI) 06/11/2022 21:59:48

![image](https://user-images.githubusercontent.com/46163555/173206110-c1bc92a2-2c0b-4aa8-82b7-444a92fb02ec.png)

![image](https://user-images.githubusercontent.com/46163555/173206168-4bdd5294-89f9-4893-9d1d-7690eaf36aee.png)

-----------
[@PySimpleGUI](https://github.com/PySimpleGUI) 06/11/2022 21:43:40

![image](https://user-images.githubusercontent.com/46163555/173205666-1ceacdd3-2237-4ccd-8f85-3745a264439f.png)

-----------
[@VatsalP](https://github.com/VatsalP) 06/11/2022 00:30:56

![PDF Merge](https://raw.githubusercontent.com/VatsalP/pdf_utility/master/pdf_utility_belt/res/images/screenshots/Capture.PNG)

-----------
[@lonewanderer27](https://github.com/lonewanderer27) About Window

![Peek 2022-06-09 17-08](https://user-images.githubusercontent.com/28822916/172815544-67924be4-00f8-4016-a34e-a96c6b82a200.gif)

-----------
[@PySimpleGUI](https://github.com/PySimpleGUI) 06/08/2022 11:33:09

![image](https://user-images.githubusercontent.com/46163555/172605458-65357ede-04c4-4173-b602-bb9c6b63cb9c.png)

![image](https://user-images.githubusercontent.com/46163555/172605580-c43cb8f2-7915-4852-a630-dab102f95662.png)

![image](https://user-images.githubusercontent.com/46163555/172605737-67b8fb96-b1dc-4028-bba0-c11054fc4751.png)

-----------
[@PySimpleGUI](https://github.com/PySimpleGUI) 06/07/2022 12:48:16

![image](https://user-images.githubusercontent.com/46163555/172382544-e6393442-a436-496a-b3d9-c2dcd15823c9.png)

-----------
[@PySimpleGUI](https://github.com/PySimpleGUI) 06/07/2022 12:31:48

![image](https://user-images.githubusercontent.com/46163555/172379207-84a42384-2936-4d2f-8e03-848710972eba.png)

-----------
[@ArchKubi](https://github.com/ArchKubi) 06/06/2022 02:12:11

![2022-06-06-051005_1280x1012_scrot](https://user-images.githubusercontent.com/80429360/172083125-16c95d55-fdfa-4f0e-a89c-641fab7cc29e.png)

-----------
[@PySimpleGUI](https://github.com/PySimpleGUI) 06/05/2022 19:42:55

![image](https://user-images.githubusercontent.com/46163555/172067615-b0548540-0b97-4ab5-bb20-6b7227ce0dac.png)

![image](https://user-images.githubusercontent.com/46163555/172067655-c510c744-269e-49f3-8d08-a8b9a673891e.png)

![image](https://user-images.githubusercontent.com/46163555/172067682-55f2a687-012b-4c31-b028-7e3e6367249f.png)

-----------
[@PySimpleGUI](https://github.com/PySimpleGUI) 06/05/2022 12:13:02

![image](https://user-images.githubusercontent.com/46163555/172049829-4979a663-3940-4d98-b286-222f2ff202f6.png)

-----------
[@PySimpleGUI](https://github.com/PySimpleGUI) 06/05/2022 12:11:44

![GraphElemSineImproved](https://user-images.githubusercontent.com/46163555/172049766-f448d269-8b82-49fa-ada4-cdc8eb2945c1.gif)

-----------
[@macdeport](https://github.com/macdeport) 06/05/2022 08:35:05

![floating-screenshot-102617](https://user-images.githubusercontent.com/26068595/172042251-f8d06a2c-c8c5-4f20-894c-3ce062d29f83.jpg)

-----------
[@infinitepower18](https://github.com/infinitepower18) 06/05/2022 00:10:14

![image](https://user-images.githubusercontent.com/44692189/172029397-c16ddad3-05fe-4567-a501-b4c29eaa00c8.png)

-----------
[@PySimpleGUI](https://github.com/PySimpleGUI) 06/04/2022 23:34:38

![DemoGraphElemSineWave](https://user-images.githubusercontent.com/46163555/172028806-b27fa366-4808-48aa-8e0a-94be6a1f52c2.gif)

![image](https://user-images.githubusercontent.com/46163555/172028834-0be38a94-06ac-450f-86ae-64fdfbce8e5b.png)

-----------
[@PySimpleGUI](https://github.com/PySimpleGUI) 06/04/2022 23:17:34

![image](https://user-images.githubusercontent.com/46163555/172028233-e1c62311-26ef-48e0-9c37-c0f0d81ec72c.png)

![dial element](https://user-images.githubusercontent.com/46163555/172028361-5a51e9b1-ceab-46b4-822f-66cc3a38da5d.gif)

![image](https://user-images.githubusercontent.com/46163555/172028469-1dc259cd-1a89-4589-8987-5db0347d7f80.png)

-----------
[@PySimpleGUI](https://github.com/PySimpleGUI) 06/04/2022 22:27:46

![PySimpleGUI Meter Example](https://user-images.githubusercontent.com/46163555/172027346-093f9720-dcad-4898-83be-90aa665392cc.gif)

-----------
[@PySimpleGUI](https://github.com/PySimpleGUI) 06/04/2022 22:17:00

![pythonw_Zg0AaJiwFm](https://user-images.githubusercontent.com/46163555/172027081-43e35a85-afc3-4fdd-b3d8-0cac893f8b02.gif)

-----------
[@ArchKubi](https://github.com/ArchKubi) 05/31/2022 06:58:52

![2022-05-31-094727_1280x1012_scrot](https://user-images.githubusercontent.com/80429360/171109760-c3d8a769-3b13-40a1-9316-6367d24152de.png)

![2022-05-31-094729_1280x1012_scrot](https://user-images.githubusercontent.com/80429360/171109766-f908a168-b8de-47f3-9ead-3387a08bac8d.png)

![2022-05-31-094732_1280x1012_scrot](https://user-images.githubusercontent.com/80429360/171109767-40a345be-fe4f-49f4-82f0-e64444585930.png)

![2022-05-31-094836_1280x1012_scrot](https://user-images.githubusercontent.com/80429360/171109964-2734751c-ec6d-4df7-881b-0656f02c8bb9.png)

![2022-05-31-094842_1280x1012_scrot](https://user-images.githubusercontent.com/80429360/171109967-0c53591b-a09b-4778-adad-ba17968b25ce.png)

![2022-05-31-095314_1280x1012_scrot](https://user-images.githubusercontent.com/80429360/171110742-a453a3b2-f7a2-4f29-8427-322067d6b40d.png)

![2022-05-31-095321_1280x1012_scrot](https://user-images.githubusercontent.com/80429360/171110745-7d8aa980-bcc0-447b-943b-b8b0308df62d.png)

-----------
[@infinitepower18](https://github.com/infinitepower18) 05/02/2022 15:50:00

![image](https://user-images.githubusercontent.com/44692189/166264588-9a02a01b-0317-4460-a800-0816f6d4686a.png)

![image](https://user-images.githubusercontent.com/44692189/166264543-c0d19403-91b4-4ad2-b729-f242550a3a50.png)

-----------
[@eagleEggs](https://github.com/eagleEggs) 05/01/2022 12:40:06

![image](https://user-images.githubusercontent.com/29800532/166146409-e37eefaf-6392-425e-90db-adeae0aaba71.png)

-----------
[@hseera](https://github.com/hseera) 05/01/2022 11:03:33

![cloudfront-manager](https://user-images.githubusercontent.com/59352356/166143098-ed907d23-2366-4b70-803b-b97cc530efee.png)

-----------
[@PySimpleGUI](https://github.com/PySimpleGUI) 04/16/2022 19:21:39

![image](https://user-images.githubusercontent.com/46163555/163688629-cbdfdfec-44b8-42da-aab1-2e6d3203a7a2.png) seeing what everyone's making!

-----------
[@PySimpleGUI](https://github.com/PySimpleGUI) 04/16/2022 13:08:06

![image](https://user-images.githubusercontent.com/46163555/163676135-526eb817-c6fd-4dc9-a46b-401947af5d2b.png)

-----------
[@wrwetzel](https://github.com/wrwetzel) 04/16/2022 12:27:46

![birdland](https://user-images.githubusercontent.com/898959/163674955-a83b5809-a7c6-4409-b511-0882014b96b5.png)

-----------
[@schlopp96](https://github.com/schlopp96) 04/06/2022 21:17:33

![v2mp3_photo](https://user-images.githubusercontent.com/71921821/162072497-805227a9-21b4-431f-84ef-25d46c062f0d.png)

-----------
[@gfcwfzkm](https://github.com/gfcwfzkm) 04/06/2022 15:08:50

![Screenshot 2022-04-06 170717](https://user-images.githubusercontent.com/5095323/162006830-7abc3992-78e7-4c48-b65b-686e82d13605.png)

-----------
[@PySimpleGUI](https://github.com/PySimpleGUI) 03/24/2022 16:02:11

![image](https://user-images.githubusercontent.com/46163555/159957868-1049d930-a6d8-40f9-9e9b-38977ba8a45e.png)

![image](https://user-images.githubusercontent.com/46163555/159958724-4b14bb15-7943-4ff2-953c-7f50f957e04b.png)

-----------
[@PySimpleGUI](https://github.com/PySimpleGUI) 03/24/2022 15:53:14

![image](https://user-images.githubusercontent.com/46163555/159956309-a71117f4-4920-42e0-a5c4-4634ae4e2557.png)

-----------
[@eliffile](https://github.com/eliffile) 03/22/2022 07:14:12

![GreetingCardMaker1](https://user-images.githubusercontent.com/98583882/159427328-cc9de232-bb0f-486e-8228-3bb08a82a88a.png)

-----------
[@NFadhlurrahman](https://github.com/NFadhlurrahman) 03/20/2022 13:47:20

![image](https://user-images.githubusercontent.com/95117217/159165374-e81edb9d-341c-45df-9222-2ad6e2adad83.png)

-----------
[@DeusAres](https://github.com/DeusAres) 03/14/2022 22:37:40

![image](https://user-images.githubusercontent.com/60852205/158272118-edf813b3-739b-4bdf-9991-384e341fcc1b.png)

-----------
[@PySimpleGUI](https://github.com/PySimpleGUI) 03/08/2022 22:12:47

![image](https://user-images.githubusercontent.com/46163555/157334139-cd16b3bd-a01b-4249-94e7-ce13b5ad19fa.png)

-----------
[@resnbl](https://github.com/resnbl) 03/07/2022 22:17:13

![tardis-show-small](https://user-images.githubusercontent.com/33208090/157126262-44cd4525-15de-4195-b6ee-39855845b741.png)

-----------
[@infinitepower18](https://github.com/infinitepower18) 03/03/2022 19:59:59

![image](https://user-images.githubusercontent.com/44692189/156643293-2c4f4f27-392c-46aa-ad56-489be14f2c85.png)

-----------
[@Zilversmit](https://github.com/Zilversmit) 02/28/2022 00:22:25

![Snap_Thursday, 24 February 2022_14h53m2s_002_Click to run](https://user-images.githubusercontent.com/98189612/155906408-97e2ec6d-80a0-47c5-b88c-b04a7ddaaff3.png)

![Snap_Friday, 25 February 2022_19h23m21s_003_Enter an SQL 'SELECT' command', 'Enter '](https://user-images.githubusercontent.com/98189612/155906363-09133513-808d-4b16-8bdc-ae4b6b2ad2bf.png)

-----------
[@eliffile](https://github.com/eliffile) 02/26/2022 05:17:23

![PCM2](https://user-images.githubusercontent.com/98583882/155830128-288a9e5b-6f5d-4d71-abbb-cdb17839fa35.jpg)

![PCM3](https://user-images.githubusercontent.com/98583882/155830138-b1ecb279-70a0-457d-9651-a715a2affab9.jpg)

![PCM5](https://user-images.githubusercontent.com/98583882/155830809-1826fecc-54d1-463e-8f94-237e42be9b40.jpg)

-----------
[@eliffile](https://github.com/eliffile) 02/20/2022 06:53:03

![Postcard Maker](https://user-images.githubusercontent.com/98583882/154831842-33be850f-c71f-43c1-83e1-fb675ebd72cc.png)

-----------
[@PySimpleGUI](https://github.com/PySimpleGUI) 02/08/2022 14:07:12

![image](https://user-images.githubusercontent.com/46163555/153002573-923f1451-edfd-498e-bb32-e99d1fd8de6e.png)

-----------
[@DeusAres](https://github.com/DeusAres) 02/08/2022 08:58:44

![image](https://user-images.githubusercontent.com/60852205/152951123-984c9b3f-3914-4d30-a0e9-2d95d47c9f7e.png)

-----------
[@PySimpleGUI](https://github.com/PySimpleGUI) 02/07/2022 01:20:01

![image](https://user-images.githubusercontent.com/46163555/152710658-cd6b8983-c9f0-4943-b964-3c52d2ad651c.png)

-----------
[@bouc79](https://github.com/bouc79) 02/06/2022 22:41:19

![Istantanea_2022-02-06_23-26-57](https://user-images.githubusercontent.com/63617159/152704550-086cd32e-5383-496d-bc14-6c93d349265b.png)

![Istantanea_2022-02-06_23-40-36](https://user-images.githubusercontent.com/63617159/152704574-dbaee0fe-0fd8-4c30-94e2-c0200b8817cf.png)

-----------
[@PySimpleGUI](https://github.com/PySimpleGUI) 02/06/2022 14:32:34

![image](https://user-images.githubusercontent.com/46163555/152685875-8aba2adc-9594-4b96-88a9-b6a814c5b81a.png)

-----------
[@eliffile](https://github.com/eliffile) 02/06/2022 09:04:59

![GreetingCardMaker1](https://user-images.githubusercontent.com/98583882/159426936-f459b937-48a2-46ac-90a3-b81c44c0cdbd.png)

![GreetingCardMaker2](https://user-images.githubusercontent.com/98583882/160012468-aacc5268-debc-416a-9f57-3316b7f242fc.png)

![GreetingCardMaker1](https://user-images.githubusercontent.com/98583882/159427328-cc9de232-bb0f-486e-8228-3bb08a82a88a.png)

-----------
[@PySimpleGUI](https://github.com/PySimpleGUI) Minecraft!

![image](https://user-images.githubusercontent.com/46163555/152643404-59069b36-efd8-4186-90d5-555453bce487.png)

-----------
[@eliffile](https://github.com/eliffile) 02/04/2022 09:56:34

![GCM](https://user-images.githubusercontent.com/98583882/152508998-a5efd1b8-f727-4f23-90ac-837d8bdcb3db.png)

-----------
[@cosme12](https://github.com/cosme12) 02/02/2022 01:50:45

![principal](https://user-images.githubusercontent.com/6611118/152079523-81e55c60-239f-4252-a088-909f114d4574.png)

![main](https://user-images.githubusercontent.com/6611118/152079751-ecc08e10-293f-45b7-a1ea-c73294d55737.png)

![panorama](https://user-images.githubusercontent.com/6611118/152080081-9387bbda-33e7-4267-94f1-186aa784488e.png)

![reservar](https://user-images.githubusercontent.com/6611118/152080091-4e5e5836-9698-4e77-a719-cbe3776fefff.png)

![resumen](https://user-images.githubusercontent.com/6611118/152080195-3fe84862-5951-4eb4-bc42-ed0dc83117f4.png)

![cc](https://user-images.githubusercontent.com/6611118/152080230-34e0ca21-f7c0-44b1-8ea6-e6ce75deee06.png)

![productos](https://user-images.githubusercontent.com/6611118/152080432-03d068e0-1390-40c0-b992-3db081f62aa8.png)

![buy](https://user-images.githubusercontent.com/6611118/152080438-5b320d9d-22e2-4358-a602-e927e46bef82.png)

![venta_cancha](https://user-images.githubusercontent.com/6611118/152080557-8d4e6a1c-16b5-4190-bd69-a8f98d14eef9.png)

-----------
[@PySimpleGUI](https://github.com/PySimpleGUI) 02/02/2022 01:01:39

![image](https://user-images.githubusercontent.com/46163555/152076781-5435a95b-5789-45dd-945a-b813d27428f3.png)

-----------
[@kcl1s](https://github.com/kcl1s) 02/02/2022 01:01:13

![robotGui](https://user-images.githubusercontent.com/13920899/152075942-c42bf63b-a380-4f09-b0d8-38d779959c21.png)

![guirobot2](https://user-images.githubusercontent.com/13920899/152076617-8bb33610-d8de-4065-9518-9ea57fe79385.png)

-----------
[@kcl1s](https://github.com/kcl1s) 02/02/2022 00:35:46

![gestures ss](https://user-images.githubusercontent.com/13920899/152074284-5cb96a57-141b-458f-8ac5-a774e1938ee3.png)

-----------
[@PySimpleGUI](https://github.com/PySimpleGUI) 01/27/2022 23:21:27

![Core Usage](https://raw.githubusercontent.com/PySimpleGUI/PySimpleGUI/master/images/for_readme/CPU%20Cores%20Dashboard%202.gif)

-----------
[@PySimpleGUI](https://github.com/PySimpleGUI) 01/27/2022 21:31:02

![image](https://user-images.githubusercontent.com/46163555/151446695-6ed8a2d1-8694-4b52-84bd-55687199404d.png)

-----------
[@WaterReNu](https://github.com/WaterReNu) 01/27/2022 20:10:58

![irrigraytype2test](https://user-images.githubusercontent.com/54043211/151436052-fd535970-06d0-48f1-98d4-d5527b99460b.jpg)

-----------
[@PySimpleGUI](https://github.com/PySimpleGUI) 01/24/2022 15:28:45

![image](https://user-images.githubusercontent.com/46163555/150811700-5622650c-8bf8-4c88-a2cb-1be60b1f4953.png)

![image](https://user-images.githubusercontent.com/46163555/150812447-92956887-dab0-460b-90f7-646ddb5a08cf.png)

-----------
[@DeusAres](https://github.com/DeusAres) 01/24/2022 12:06:52

![ezgif-3-523b1dd597](https://user-images.githubusercontent.com/60852205/150779961-1cf6273c-0ef7-406a-85f6-09e19dd48694.gif)

-----------
[@vohe](https://github.com/vohe) 01/23/2022 13:53:09

![AudioRecScreenshot](https://user-images.githubusercontent.com/7021635/150681690-1874c8c0-4464-46a4-ae0f-748a618fb845.png)

-----------
[@PySimpleGUI](https://github.com/PySimpleGUI) 01/17/2022 18:34:55

![image](https://user-images.githubusercontent.com/46163555/149822051-4f2a53d2-2b77-4dcf-ab13-1abe5ac724ed.png)

![image](https://user-images.githubusercontent.com/46163555/149822357-f588e0f2-a87a-4132-b092-e200bcf3e61c.png)

-----------
[@WaterReNu](https://github.com/WaterReNu) 01/16/2022 21:53:25

![irrirgay controller front](https://user-images.githubusercontent.com/54043211/149679302-8775e16a-d139-4015-b96c-8d7e1df3253a.jpg)

![IrriGRAY controller inside](https://user-images.githubusercontent.com/54043211/149679305-56643f4c-8b48-4c2f-9261-1d5912f8864a.jpg)

![filter 3 clean](https://user-images.githubusercontent.com/54043211/149679420-74784316-966d-422d-8dd7-0097902487a1.PNG)

-----------
[@DeusAres](https://github.com/DeusAres) 01/16/2022 15:01:47

![unknown_2022 01 16-14 37_1](https://user-images.githubusercontent.com/60852205/149665438-b7f6bc47-0fc9-49b2-adf4-bd90f3c7e9d4.gif)

-----------
[@tostos5963](https://github.com/tostos5963) 01/13/2022 22:13:15

![PySimpleGUI-MahjongSolitaire](https://user-images.githubusercontent.com/15520094/149417117-f2acfa8e-a197-4180-a391-cf6cde28cdef.gif)

-----------
[@tostos5963](https://github.com/tostos5963) 01/13/2022 15:26:56

![MahjongSolitaire](https://user-images.githubusercontent.com/15520094/149358695-c47b5956-785f-4bc5-a74c-050bfb56fee7.PNG)

-----------
[@shullaw](https://github.com/shullaw) 01/13/2022 02:19:24

![image](https://user-images.githubusercontent.com/48638106/149253678-77e128ca-63ac-4ad6-84d5-75a8778c16c0.png)

-----------
[@Cornbrother](https://github.com/Cornbrother) 01/07/2022 18:47:55

![image](https://user-images.githubusercontent.com/64257019/148592014-951225aa-6a8f-456f-b3d8-f02bfe05bde8.png)

-----------
[@autostatic](https://github.com/autostatic) 12/27/2021 15:43:43

![rtcqs_gui](https://user-images.githubusercontent.com/477316/147486841-24164ebf-9190-4ade-838e-8c64f68b501e.png)

![rtcqs_about](https://user-images.githubusercontent.com/477316/147486857-6057aa0f-abbc-49ad-9769-f1db23a20e87.png)

-----------
[@PySimpleGUI](https://github.com/PySimpleGUI) 12/20/2021 15:41:30

![image](https://user-images.githubusercontent.com/46163555/146793694-9d1d7bba-5654-4394-ab7f-60460b7d2b6f.png)

-----------
[@johanjohan](https://github.com/johanjohan) 12/20/2021 15:25:43

![image](https://user-images.githubusercontent.com/6679464/146790842-f0f02d09-2e96-46f1-ab31-57b77dc7890d.png)

-----------
[@johanjohan](https://github.com/johanjohan) 12/19/2021 17:07:16

![gui_image001](https://user-images.githubusercontent.com/6679464/146683745-a1c73dec-e39c-497b-a0aa-55757c6e5532.png)

-----------
[@andrewmk](https://github.com/andrewmk) 12/19/2021 13:29:03

![Screenshot 2021-12-19 132059](https://user-images.githubusercontent.com/1872642/146676348-d8c6ee7f-cc81-44b9-8a17-010a880b0afb.png)

-----------
[@WaterReNu](https://github.com/WaterReNu) 12/08/2021 17:34:51

![auto-op](https://user-images.githubusercontent.com/54043211/145255870-32219224-f533-4e29-8483-ef87cb473501.jpg)

-----------
[@andrewmk](https://github.com/andrewmk) 12/05/2021 00:39:31

![Screenshot 2021-12-05 000125](https://user-images.githubusercontent.com/1872642/144728906-839f52dd-e1e3-4e57-bd82-e10dd129a465.png)

-----------
[@PySimpleGUI](https://github.com/PySimpleGUI) 12/02/2021 16:14:05

![image](https://user-images.githubusercontent.com/46163555/144459932-37a651da-f0a3-46bf-abcb-85ebd95cb1a4.png)

![image](https://user-images.githubusercontent.com/46163555/144459962-60bb6847-4b24-4ad7-90ae-29076ab71221.png)

-----------
[@andrewmk](https://github.com/andrewmk) 12/02/2021 16:07:45

![Screenshot 2021-12-07](https://user-images.githubusercontent.com/1872642/145014749-a344841d-6934-484d-9955-977f5e3470bc.png)

![image2](https://user-images.githubusercontent.com/1872642/144458506-8c187563-7396-4d15-b652-b15edff37213.png)

-----------
[@Vresod](https://github.com/Vresod) 11/23/2021 23:47:10

![AUE-P](https://user-images.githubusercontent.com/40863375/143146218-e6d0b3a9-4369-4808-aaa8-c0d91da0a1db.png)

-----------
[@PySimpleGUI](https://github.com/PySimpleGUI) 11/23/2021 15:28:51

![image](https://user-images.githubusercontent.com/46163555/143053295-0e71ef2f-acf5-44ca-a488-23a5875a9495.png)

-----------
[@PySimpleGUI](https://github.com/PySimpleGUI) 11/23/2021 14:57:40

![image](https://user-images.githubusercontent.com/46163555/143047359-4604c104-0aa6-46ac-a8ab-8389e217e638.png)

-----------
[@frici11](https://github.com/frici11) 11/23/2021 13:41:00

![Screenshot (109)](https://user-images.githubusercontent.com/78821165/143034164-f834fd93-2bfb-4eb9-b8d0-de897c7562d9.png)

![Screenshot (110)](https://user-images.githubusercontent.com/78821165/143034169-bf81266e-d1bf-454e-bff5-1fc9690e2dfe.png)

![Screenshot (112)](https://user-images.githubusercontent.com/78821165/143034170-73fa684a-f817-41be-a293-3f52f6025ba1.png)

-----------
[@PySimpleGUI](https://github.com/PySimpleGUI) 11/20/2021 12:17:53

![image](https://user-images.githubusercontent.com/46163555/142726016-f551093c-51ce-4215-aad5-36ae6368289a.png)

-----------
[@luflopes](https://github.com/luflopes) 11/19/2021 21:30:33

![user_login](https://user-images.githubusercontent.com/92451100/142693078-88d3c56e-5d8f-4f5a-9cd7-7656d3af3aa0.PNG)

![user_registration](https://user-images.githubusercontent.com/92451100/142693195-8378554c-818b-4661-9692-2c887b8f0965.PNG)

![adm_register_kpi](https://user-images.githubusercontent.com/92451100/142693318-e0e8b48f-4a23-49cb-a6c9-028c88bb4756.PNG)

![adm_users](https://user-images.githubusercontent.com/92451100/142693616-3871da3d-6cba-4c47-a01f-371167270071.PNG)

![adm_dashboard](https://user-images.githubusercontent.com/92451100/142693745-5bd6a199-1e37-4cb3-bab8-49daff8b26c3.PNG)

-----------
[@Scania-Creations-16](https://github.com/Scania-Creations-16) 11/04/2021 02:55:59

![yt1](https://user-images.githubusercontent.com/91425738/140249931-76fdda21-fbdf-42a0-81a7-add95ab122b6.png)

![yt2](https://user-images.githubusercontent.com/91425738/140249937-26fba679-b813-471e-a09c-f81ff1a7a53d.png)

![yt3](https://user-images.githubusercontent.com/91425738/140249945-0b7d045d-4941-4aa7-a399-969cb8b6c87f.png)

![yt4](https://user-images.githubusercontent.com/91425738/140249959-8965f606-70c6-4b70-b703-0b82a381587f.png)

-----------
[@Scania-Creations-16](https://github.com/Scania-Creations-16) 10/31/2021 04:14:25

![mp1](https://user-images.githubusercontent.com/91425738/139567280-a9b18a68-e052-414a-898c-7537c90f2aac.png)

![mp2](https://user-images.githubusercontent.com/91425738/139567295-35c8d463-2a27-4724-94e6-c21c85aa55e4.png)

-----------
[@PySimpleGUI](https://github.com/PySimpleGUI) 10/22/2021 14:51:31

![image](https://user-images.githubusercontent.com/46163555/138475561-64b25d75-1acc-4193-b5d9-f3b7e9e8abc6.png)

![image](https://user-images.githubusercontent.com/46163555/138475663-1da815d8-0318-460f-8982-d84be9ed515d.png)

-----------
[@mechanicalnull](https://github.com/mechanicalnull) 10/22/2021 12:04:54

![fuzzwatch_ui](https://user-images.githubusercontent.com/43920110/138450454-4132f4ab-f402-4d34-ba6a-4c91fe45dce3.gif)

-----------
[@hseera](https://github.com/hseera) 09/25/2021 11:30:05

![image](https://user-images.githubusercontent.com/59352356/134769839-7840abd4-99a9-4ba6-bdfe-9ddcb08243ef.png)

-----------
[@PySimpleGUI](https://github.com/PySimpleGUI) 09/04/2021 14:37:53

![image](https://user-images.githubusercontent.com/46163555/132098195-4bb4386e-cc60-4dc9-a68c-ccfe6827496f.png)

-----------
[@hseera](https://github.com/hseera) 09/04/2021 07:29:45

![sqs-workbench](https://user-images.githubusercontent.com/59352356/132086545-7856dd1a-8a6c-4dfc-a707-a8077262f894.png)

![post](https://user-images.githubusercontent.com/59352356/132086682-5188c2b3-a71c-47c8-b0c2-350ddf5ecdbf.png)

-----------
[@PySimpleGUI](https://github.com/PySimpleGUI) 08/31/2021 13:09:22

![image](https://user-images.githubusercontent.com/46163555/131508042-05505690-e1f6-4c01-9840-f40bf05f5163.png)

-----------
[@readicculus](https://github.com/readicculus) 08/30/2021 22:16:48

![image](https://user-images.githubusercontent.com/3818801/131410876-c3ba93ac-1c0d-4147-9c04-54b2eebe8e04.png)

![image](https://user-images.githubusercontent.com/3818801/131413322-c183a238-ae5b-492d-bbee-0b0cf158873a.png)

![image](https://user-images.githubusercontent.com/3818801/131411661-4ca333cf-ef6b-4976-995a-db5c19236fd3.png)

![test_kotz_2019_fl04_C_20190510_011336 394023_rgb-1](https://user-images.githubusercontent.com/3818801/131412847-f424c44b-7085-4ed6-9812-f43912b6ef84.jpg)

![image](https://user-images.githubusercontent.com/3818801/131412028-3f0db248-60b2-4f26-bd6b-6a6dc491d2b7.png)

-----------
[@PySimpleGUI](https://github.com/PySimpleGUI) 08/11/2021 20:28:32

![image](https://user-images.githubusercontent.com/46163555/129097530-aa6eabc8-d730-4a0b-a6f7-15a4906b7c6c.png)

-----------
[@AyhamSaffar](https://github.com/AyhamSaffar) 08/11/2021 00:21:44

![Perfect Result](https://user-images.githubusercontent.com/76114207/128950253-adabcde5-2013-4e9d-be3b-40bbbc947922.png)

-----------
[@PySimpleGUI](https://github.com/PySimpleGUI) 08/07/2021 16:30:26

![bFMFWthH2G](https://user-images.githubusercontent.com/46163555/128607171-d6ce5683-7890-46f8-8908-edfd224ff165.gif)

![EhFQy6gaHl](https://user-images.githubusercontent.com/46163555/128607117-c4c9848a-9cfd-4c67-bd19-56bb11527937.gif)

![eqYKWKRkUF](https://user-images.githubusercontent.com/46163555/128607125-7ed1ae83-9376-4322-bc68-c1d182a9626a.gif)

-----------
[@jason990420](https://github.com/jason990420) 08/07/2021 11:00:56

![Fold](https://user-images.githubusercontent.com/55352169/128599441-aa1fc879-c88e-48a9-9d5c-856f1bbf6d2e.gif)

-----------
[@vinniec](https://github.com/vinniec) 08/07/2021 07:57:36

![ppp1](https://user-images.githubusercontent.com/710699/128593320-9eb54fe3-7649-4fa0-893e-4946ebc1469a.jpg)

![ppp2](https://user-images.githubusercontent.com/710699/128593322-cb3e4e1c-1433-4ffc-9283-d9a54d086618.jpg)

![ppp3](https://user-images.githubusercontent.com/710699/128593326-b9516e7a-9cdc-45f3-a0bd-ab254de1f7e0.jpg)

-----------
[@ghost](https://github.com/ghost) A Simple Random-Password Generator

![Alt Text](https://dev-to-uploads.s3.amazonaws.com/uploads/articles/fi9x88c3iy1tipvxra59.PNG)

-----------
[@ghost](https://github.com/ghost) 05/27/2021 07:20:01

![image](https://user-images.githubusercontent.com/66465441/119782575-fb6fd600-bee9-11eb-992a-cc24d12d0c16.png)

-----------
[@Fethbita](https://github.com/Fethbita) 05/20/2021 15:10:13

![a demo of the program](https://raw.githubusercontent.com/Fethbita/eMRTD_face_access/main/docs/images/demo.gif)

-----------
[@elibroftw](https://github.com/elibroftw) 05/02/2021 00:27:51

![image](https://user-images.githubusercontent.com/21298211/116798206-46e5be80-aabb-11eb-819d-dd8b6a229368.png)

![image](https://user-images.githubusercontent.com/21298211/116798212-5533da80-aabb-11eb-88e8-279a8efd3c70.png)

-----------
[@daemon2021](https://github.com/daemon2021) 04/28/2021 08:26:39

![immagine](https://user-images.githubusercontent.com/80693149/116367433-a5831200-a807-11eb-9e3a-0238d93ba5cd.png)

-----------
[@pamoroso](https://github.com/pamoroso) 04/21/2021 14:05:25

![spacestills](https://user-images.githubusercontent.com/10342479/115567113-2fd4ee80-a2bb-11eb-89bd-03ca3864be85.jpg)

-----------
[@neovich](https://github.com/neovich) 04/05/2021 13:31:15

![faders_VU_meter](https://user-images.githubusercontent.com/49742791/113578741-a12f6300-9666-11eb-9c60-0cc2eca176e1.png)

-----------
[@neovich](https://github.com/neovich) 04/05/2021 05:28:37

![msg play - pic 1](https://user-images.githubusercontent.com/49742791/113540442-84257080-9623-11eb-8437-0da3bbe0ad88.png)

![msg play - pic 2](https://user-images.githubusercontent.com/49742791/113540456-8d164200-9623-11eb-8da2-a7c47e43fd37.png)

![msg play - pic 3](https://user-images.githubusercontent.com/49742791/113540468-91425f80-9623-11eb-812e-affc5528e400.png)

-----------
[@PySimpleGUI](https://github.com/PySimpleGUI) 04/04/2021 22:05:55

![image](https://user-images.githubusercontent.com/46163555/113522583-c1c8c180-956f-11eb-812d-237a4da58f57.png)

-----------
[@neovich](https://github.com/neovich) 04/04/2021 08:23:29

![DMX example](https://user-images.githubusercontent.com/49742791/113503031-c8a50380-9572-11eb-94a0-bb2816170870.png)

-----------
[@pgbowers](https://github.com/pgbowers) Raspi_CPU_Temperature_Monitor

![Monitor screenshot](https://raw.githubusercontent.com/pgbowers/Raspi_CPU_Temperature_Monitor/main/CPU_Temp_Screen1.png)

-----------
[@ThomasFreedman](https://github.com/ThomasFreedman) 03/17/2021 14:40:26

![image](https://user-images.githubusercontent.com/11077042/111485603-c0407200-8704-11eb-94b8-d196d31e8cb6.png)

![pBoxImg2](https://user-images.githubusercontent.com/11077042/111503858-246b3200-8715-11eb-81b2-8eafca94a19e.jpg)

-----------
[@PySimpleGUI](https://github.com/PySimpleGUI) 03/10/2021 16:42:53

![Ml8rxsYCoW](https://user-images.githubusercontent.com/46163555/110664775-b44d3100-8195-11eb-81c7-4c3baab01bf7.gif)

-----------
[@ill13](https://github.com/ill13) 03/08/2021 22:03:07

![demo](https://user-images.githubusercontent.com/10509740/110387619-dfb60b80-802f-11eb-92ab-f4eb8b03c6cb.gif)

-----------
[@vinniec](https://github.com/vinniec) 03/04/2021 20:44:34

![pysimpleregex](https://user-images.githubusercontent.com/710699/110026317-c875d600-7d30-11eb-9613-9cf76b475f18.jpg)

![estimation](https://user-images.githubusercontent.com/710699/110027861-cca2f300-7d32-11eb-90a3-a3894924c594.jpg)

-----------
[@pgbowers](https://github.com/pgbowers) 03/02/2021 14:55:14

![Guess_screenshot1](https://user-images.githubusercontent.com/2387580/109666338-7a50af00-7b45-11eb-8ba6-e37bcdc17fe9.png)

-----------
[@techtanic](https://github.com/techtanic) 02/03/2021 16:11:53

![](https://cdn.discordapp.com/attachments/678549756942876692/806556442383220786/unknown.png)

![](https://cdn.discordapp.com/attachments/678549756942876692/806555709260693524/image_5.png)

![](https://cdn.discordapp.com/attachments/678549756942876692/806555017057796136/image_4.png)

-----------
[@jason990420](https://github.com/jason990420) 02/02/2021 10:18:38

![image](https://user-images.githubusercontent.com/55352169/106585980-e52cbb80-6582-11eb-9bf8-9b593ca3631e.png)

-----------
[@jason990420](https://github.com/jason990420) 12/31/2020 20:08:31

![image](https://user-images.githubusercontent.com/55352169/103424390-df8c3080-4be6-11eb-83ac-e8ba862bc6e4.png)

-----------
[@ingoogni](https://github.com/ingoogni) 12/28/2020 13:30:50

![recorder](https://user-images.githubusercontent.com/22236628/103217587-3957d680-4919-11eb-8921-527609cbe8bb.png)

-----------
[@d-flood](https://github.com/d-flood) 12/23/2020 13:20:24

![appex_dynamic_layout](https://user-images.githubusercontent.com/69060117/102998098-632a8b00-451e-11eb-93a3-98366db7f4ec.gif)

![appex_dark_navigation_example](https://user-images.githubusercontent.com/69060117/102998106-6a519900-451e-11eb-98a2-fe7e2ab47f46.gif)

-----------
[@mo-han](https://github.com/mo-han) 12/09/2020 00:47:23

![](https://user-images.githubusercontent.com/9916948/101477038-9c44f600-3989-11eb-8b2d-58a3bd362c21.png)

-----------
[@jason990420](https://github.com/jason990420) 11/25/2020 21:26:16

![image](https://user-images.githubusercontent.com/55352169/100282952-87d72580-2fa7-11eb-9901-9f6dcb376732.png)

-----------
[@jason990420](https://github.com/jason990420) 11/25/2020 12:56:45

![image](https://user-images.githubusercontent.com/55352169/100229770-b6c9a900-2f5f-11eb-8440-aa3fc983601e.png)

-----------
[@Kodikuu](https://github.com/Kodikuu) 11/06/2020 18:01:53

![image](https://user-images.githubusercontent.com/16600839/98399289-1405c500-205a-11eb-8d33-ed92aaac6259.png)

-----------
[@Kodikuu](https://github.com/Kodikuu) 11/06/2020 12:18:24

![desktop](https://user-images.githubusercontent.com/16600839/98252428-d6c60800-1f71-11eb-8068-bce7d97460bf.gif)

-----------
[@PyICoder](https://github.com/PyICoder) 11/02/2020 07:27:14

![image](https://user-images.githubusercontent.com/54691311/97840869-a3e1f280-1c99-11eb-9337-8055e3680987.png)

-----------
[@d-flood](https://github.com/d-flood) 11/01/2020 23:49:39

![image](https://user-images.githubusercontent.com/69060117/97818562-fe2f8300-1c9a-11eb-9198-e2d4877d5c9b.png)

-----------
[@mainer-hat](https://github.com/mainer-hat) 10/27/2020 15:56:03

![Screenshot from 2020-10-27 11-20-18](https://user-images.githubusercontent.com/46383650/97326760-b4820b00-184a-11eb-83e3-e0ded7928eef.png)

![Screenshot from 2020-10-27 11-36-25](https://user-images.githubusercontent.com/46383650/97326764-b51aa180-184a-11eb-99f9-ad13eac2ddc4.png)

![Screenshot from 2020-10-27 11-37-21](https://user-images.githubusercontent.com/46383650/97326767-b51aa180-184a-11eb-81f3-e91bda6852ba.png)

![Screenshot from 2020-10-27 11-41-37](https://user-images.githubusercontent.com/46383650/97326768-b51aa180-184a-11eb-992c-cd5f60aa1ddc.png)

![Screenshot from 2020-10-27 11-42-05](https://user-images.githubusercontent.com/46383650/97326769-b5b33800-184a-11eb-94ef-6891c7754e74.png)

![Screenshot from 2020-10-27 11-42-56](https://user-images.githubusercontent.com/46383650/97326771-b5b33800-184a-11eb-86e9-ff29ac55ef61.png)

-----------
[@PySimpleGUI](https://github.com/PySimpleGUI) 10/16/2020 03:26:07

![image](https://user-images.githubusercontent.com/46163555/96208036-a1ae3300-0f3a-11eb-9473-8f270f740e8b.png)

![image](https://user-images.githubusercontent.com/46163555/96208705-1f267300-0f3c-11eb-83ca-2a6456bc746e.png)

-----------
[@alexBoldea](https://github.com/alexBoldea) 10/15/2020 19:44:28

![welcome](https://user-images.githubusercontent.com/38548951/96178277-d2d93400-0f37-11eb-8870-9f2eb5833d91.PNG)

![folderSelect](https://user-images.githubusercontent.com/38548951/96178287-d79de800-0f37-11eb-9b75-f1579b53d5ad.PNG)

![main](https://user-images.githubusercontent.com/38548951/96178294-da004200-0f37-11eb-8108-668e3f2f03be.PNG)

-----------
[@gregorystorer](https://github.com/gregorystorer) 10/14/2020 07:03:30

![Selection_125](https://user-images.githubusercontent.com/24841837/95954111-8b26af80-0e46-11eb-965d-3d6c7ac5924e.png)

-----------
[@PySimpleGUI](https://github.com/PySimpleGUI) 10/12/2020 16:33:55

![image](https://user-images.githubusercontent.com/46163555/95768351-2facc400-0c84-11eb-8a65-d9d288189b97.png)

![image](https://user-images.githubusercontent.com/46163555/95769717-4fdd8280-0c86-11eb-9583-90a9dfbf49e7.png)

![image](https://user-images.githubusercontent.com/46163555/95769668-3c321c00-0c86-11eb-8986-1f56fe4a5124.png)

-----------
[@amantotek](https://github.com/amantotek) 10/12/2020 14:56:34

![20201011PSGegMultilineColorV05](https://user-images.githubusercontent.com/7591528/95759999-672a6900-0ca2-11eb-8990-4d65ac57eba8.png)

-----------
[@aajshaw](https://github.com/aajshaw) 09/26/2020 13:25:57

![image](https://user-images.githubusercontent.com/11177450/94341489-a057ad80-0001-11eb-9cbe-3c40dd5a7bf5.png)

-----------
[@PySimpleSQL](https://github.com/PySimpleSQL) 08/25/2020 20:27:00

![image](https://user-images.githubusercontent.com/70232210/91221903-6b97c400-e6ec-11ea-8297-dc4e19cde801.png)

![image](https://user-images.githubusercontent.com/70232210/91223157-39876180-e6ee-11ea-936d-d7fb9a4894cc.png)

-----------
[@moabdali](https://github.com/moabdali) 08/12/2020 05:31:19

![image](https://user-images.githubusercontent.com/64987634/89836775-15902180-db2d-11ea-80cd-c39d432bcc4d.png)

-----------
[@vohe](https://github.com/vohe) 08/08/2020 11:11:29

![Picture](https://user-images.githubusercontent.com/7021635/89708548-82ae8600-d978-11ea-8a8d-59b24e092830.png)

-----------
[@vohe](https://github.com/vohe) 08/05/2020 13:31:05

![Popup Directory](https://user-images.githubusercontent.com/7021635/89418628-9c5d8c80-d730-11ea-9f6f-42d190cfdbf5.png)

![Popup Directory2](https://user-images.githubusercontent.com/7021635/89418636-9e275000-d730-11ea-8de6-f02c4a304701.png)

-----------
[@dfatka](https://github.com/dfatka) 08/03/2020 22:01:21

![screenshot](https://user-images.githubusercontent.com/67927838/89231341-6d86cf80-d5e5-11ea-8b55-b3e8b15f08fa.png)

-----------
[@vohe](https://github.com/vohe) 08/02/2020 17:28:23

![mockupall](https://user-images.githubusercontent.com/7021635/89128448-ec9cda80-d4f5-11ea-965d-05cef5844f8f.png)

-----------
[@vohe](https://github.com/vohe) 07/05/2020 16:45:42

![english](https://user-images.githubusercontent.com/7021635/86537489-b61c7180-beef-11ea-9b65-4d11b0a4d515.png)

![german](https://user-images.githubusercontent.com/7021635/86537492-b7e63500-beef-11ea-8b41-e79d1cbbc904.png)

![lowgerman](https://user-images.githubusercontent.com/7021635/86537494-b9aff880-beef-11ea-9a07-d1503e462d5f.png)

-----------
[@vohe](https://github.com/vohe) 07/04/2020 15:43:31

![Audiorecorder (spotify)](https://user-images.githubusercontent.com/7021635/86515989-6a00fc80-be1d-11ea-89c9-08411c829eb7.png)

-----------
[@kovadarra](https://github.com/kovadarra) 06/17/2020 10:28:51

![grafik](https://user-images.githubusercontent.com/58000806/84886138-ad790e00-b09c-11ea-933c-404a5476d8ca.png)

![grafik](https://user-images.githubusercontent.com/58000806/84886430-1791b300-b09d-11ea-8534-c1658df63a8a.png)

-----------
[@martinmeteor](https://github.com/martinmeteor) 06/14/2020 15:36:26

![m_spec setup](https://user-images.githubusercontent.com/58822518/84597253-1412e780-ae63-11ea-855b-8f7ca8f6f967.PNG)

![m_spec add rows](https://user-images.githubusercontent.com/58822518/84597322-8257aa00-ae63-11ea-8a4b-3ee2a682f84f.PNG)

![m_spec calibration](https://user-images.githubusercontent.com/58822518/84597292-576d5600-ae63-11ea-8d2e-3b64e936fbd2.PNG)

![m_spec plot spectrum](https://user-images.githubusercontent.com/58822518/84597347-b29f4880-ae63-11ea-94eb-caf6eb22f621.PNG)

![S20191214_231941_MAI_2label](https://user-images.githubusercontent.com/58822518/84597472-7c15fd80-ae64-11ea-96e8-d632d47eff77.png)

-----------
[@sharathraj-tech](https://github.com/sharathraj-tech) 06/08/2020 03:38:01

![image](https://user-images.githubusercontent.com/11161087/83989841-5620c280-a965-11ea-923e-7e3f8482f1f8.png)

![image](https://user-images.githubusercontent.com/11161087/83989876-6c2e8300-a965-11ea-943c-f924bf508606.png)

![image](https://user-images.githubusercontent.com/11161087/83989922-91bb8c80-a965-11ea-814f-d1267674e022.png)

![image](https://user-images.githubusercontent.com/11161087/83990178-5e2d3200-a966-11ea-93cd-58b592af8538.png)

![image](https://user-images.githubusercontent.com/11161087/83990270-ac423580-a966-11ea-8265-b44497eb8180.png)

-----------
[@mbilalakmal](https://github.com/mbilalakmal) 06/07/2020 02:07:48

![Screenshot (118)](https://user-images.githubusercontent.com/37498621/83958612-43d35580-a88d-11ea-8edd-91d22f77c4ea.png)

![Screenshot (120)](https://user-images.githubusercontent.com/37498621/83958616-459d1900-a88d-11ea-9ceb-33ddf59c81c7.png)

-----------
[@ChristianReizner](https://github.com/ChristianReizner) 06/06/2020 15:50:19

![main](https://user-images.githubusercontent.com/66523816/83948061-1bab0e80-a81b-11ea-80d8-b2e46e64e2ac.png)

![database](https://user-images.githubusercontent.com/66523816/83948126-7f353c00-a81b-11ea-8e30-53eb11cf15a5.png)

![pull](https://user-images.githubusercontent.com/66523816/83948191-f1a61c00-a81b-11ea-84e5-85e4764d4b97.png)

![chart](https://user-images.githubusercontent.com/66523816/83948270-65482900-a81c-11ea-9e01-754d3e62f4f0.png)

![consultation sheet](https://user-images.githubusercontent.com/66523816/83948412-62016d00-a81d-11ea-8cb7-b273a78a6b66.png)

![study_databasepng](https://user-images.githubusercontent.com/66523816/83948518-f10e8500-a81d-11ea-8e37-6ecbaaea950b.png)

-----------
[@Zain-Bin-Arshad](https://github.com/Zain-Bin-Arshad) 05/31/2020 07:43:59

![pdf](https://user-images.githubusercontent.com/49767636/83328539-26a2f380-a29d-11ea-993c-887ef9cfe77b.gif)

![des](https://user-images.githubusercontent.com/49767636/83347133-3de4ee00-a33c-11ea-819b-822ae5e52a57.jpeg)

-----------
[@Ruakuu](https://github.com/Ruakuu) 04/30/2020 09:07:13

![Screenshot from 2020-04-30 03-58-11](https://user-images.githubusercontent.com/64561775/80692496-41fcc200-8a97-11ea-932c-5368a298848d.png)

![Screenshot from 2020-04-30 04-11-25](https://user-images.githubusercontent.com/64561775/80693567-d1ef3b80-8a98-11ea-8820-daa85b06c271.png)

-----------
[@sharathraj-tech](https://github.com/sharathraj-tech) 03/27/2020 17:06:56

![Capture](https://user-images.githubusercontent.com/11161087/77781242-40487480-707b-11ea-8cd6-5c5e2c9f9ebb.JPG)

![Admin Dashboard](https://user-images.githubusercontent.com/11161087/77781024-df20a100-707a-11ea-9546-cc3b6d86c801.JPG)

-----------
[@SuperMechaDeathChrist](https://github.com/SuperMechaDeathChrist) 01/02/2020 21:30:42

![browser_example](https://user-images.githubusercontent.com/31192003/71693310-c5203c80-2d71-11ea-9cd2-59b0ea84222f.gif)

-----------
[@PySimpleGUI](https://github.com/PySimpleGUI) 12/06/2019 16:10:09

![70087235-274e1c00-15d1-11ea-8f81-582f7c3c05ef](https://user-images.githubusercontent.com/46163555/70337323-d29ce200-1818-11ea-9c32-9fbbaf8166a9.gif)

![image](https://user-images.githubusercontent.com/46163555/70337203-9d908f80-1818-11ea-957d-a26d313d8d14.png)

![image](https://user-images.githubusercontent.com/46163555/70337218-a3867080-1818-11ea-80e3-807dd0fece78.png)

![image](https://user-images.githubusercontent.com/46163555/70337249-ac774200-1818-11ea-8fac-cb981e5469a2.png)

-----------
[@PySimpleGUI](https://github.com/PySimpleGUI) 11/22/2019 15:39:35

![image](https://user-images.githubusercontent.com/46163555/69439135-554f7880-0d14-11ea-97bf-5bd7235b1e4a.png)

-----------
[@SuperMechaDeathChrist](https://github.com/SuperMechaDeathChrist) 10/31/2019 02:23:51

![ezgif com-video-to-gif](https://user-images.githubusercontent.com/31192003/67912084-5b579c80-fb4e-11e9-9acb-208e373a1ae6.gif)

-----------
[@SuperMechaDeathChrist](https://github.com/SuperMechaDeathChrist) 08/25/2019 22:30:11

![ezgif com-optimize](https://user-images.githubusercontent.com/31192003/63656691-f56d2400-c75c-11e9-817b-fe139db7f4d9.gif)

-----------
[@eagleEggs](https://github.com/eagleEggs) 08/24/2019 03:27:25

![image](https://user-images.githubusercontent.com/29800532/63632049-7f9e7680-c5fd-11e9-973b-d226b17e471b.png)

-----------
[@PySimpleGUI](https://github.com/PySimpleGUI) 08/23/2019 23:32:40

![image](https://user-images.githubusercontent.com/46163555/63628842-c29c2200-c5dc-11e9-8a68-20880e12a10b.png)

-----------
[@MikeTheWatchGuy](https://github.com/MikeTheWatchGuy) 08/11/2019 09:52:53

![concurrent_windows](https://user-images.githubusercontent.com/13696193/62832448-3eb96180-bbfc-11e9-8777-6f2669566c93.png)

![downloads](https://user-images.githubusercontent.com/13696193/62832449-3eb96180-bbfc-11e9-8311-7fe67959705c.png)

![main](https://user-images.githubusercontent.com/13696193/62832450-3eb96180-bbfc-11e9-993e-077ea885f0fb.png)

-----------
[@IsaacLance](https://github.com/IsaacLance) 08/10/2019 03:43:47

![GUI](https://user-images.githubusercontent.com/32314072/62816982-18a09e00-bae4-11e9-99c8-19ee1fa476cf.png)

![SeleniumWindow](https://user-images.githubusercontent.com/32314072/62817072-6964c680-bae5-11e9-80f2-a69695b703f9.png)

![OBSView](https://user-images.githubusercontent.com/32314072/62816983-18a09e00-bae4-11e9-8150-3096d6327d69.png)

-----------
[@MikeTheWatchGuy](https://github.com/MikeTheWatchGuy) 08/07/2019 23:34:58

![Captura](https://user-images.githubusercontent.com/31192003/57186693-78febe80-6ea9-11e9-837e-09d72dfa3b6d.PNG)

-----------
[@killyone](https://github.com/killyone) 06/20/2019 04:15:02

![image](https://user-images.githubusercontent.com/5907420/59818085-08402400-92e8-11e9-897f-5041fdcb62b2.png)

-----------
[@eagleEggs](https://github.com/eagleEggs) 03/25/2019 15:44:50

![image](https://user-images.githubusercontent.com/29800532/54933556-3c779480-4ef3-11e9-94ab-ab3734ae300f.png)

![image](https://user-images.githubusercontent.com/29800532/54933563-413c4880-4ef3-11e9-9ea5-785e82a87092.png)

![image](https://user-images.githubusercontent.com/29800532/54933576-46999300-4ef3-11e9-8880-29b1d604978f.png)

![image](https://user-images.githubusercontent.com/29800532/54933586-4ac5b080-4ef3-11e9-82bb-43a177b12df0.png)

-----------
[@btnpushnmunky](https://github.com/btnpushnmunky) 12/14/2018 16:50:36

![boxcalculator](https://github.com/btnpushnmunky/boxcalculator/raw/master/screen.png)

-----------
[@MikeTheWatchGuy](https://github.com/MikeTheWatchGuy) 11/28/2018 15:43:40

![image](https://user-images.githubusercontent.com/5184182/49162162-5106a000-f2f8-11e8-8873-d56682df7d33.png)

-----------
[@eagleEggs](https://github.com/eagleEggs) 11/24/2018 05:46:53

![image](https://user-images.githubusercontent.com/29800532/48964922-8d48a200-ef80-11e8-97b1-18d152954d5c.png)

![image](https://user-images.githubusercontent.com/29800532/48964965-9dad4c80-ef81-11e8-8ef8-05e282409c2e.png)

![image](https://user-images.githubusercontent.com/29800532/48964924-a6e9e980-ef80-11e8-9147-8aec7a38e9cd.png)

![image](https://user-images.githubusercontent.com/29800532/48964929-b701c900-ef80-11e8-9805-bd802b7460bd.png)

![image](https://user-images.githubusercontent.com/29800532/48964932-c41eb800-ef80-11e8-8cfe-c6bb727ffabb.png)

![image](https://user-images.githubusercontent.com/29800532/48964972-c7667380-ef81-11e8-9746-98714b8b062e.png)

-----------
[@john144](https://github.com/john144) 11/20/2018 20:12:20

![2018-11-20 13_44_42-log window](https://user-images.githubusercontent.com/6464098/48798630-a7595a80-ecca-11e8-95aa-34cb0045e86a.png)

![2018-11-20 13_55_56-synchdir](https://user-images.githubusercontent.com/6464098/48799175-12eff780-eccc-11e8-8b87-912ea267284e.png)

-----------
[@MikeTheWatchGuy](https://github.com/MikeTheWatchGuy) 11/18/2018 16:55:15

![snag-0258](https://user-images.githubusercontent.com/13696193/48574787-10f9f300-e8de-11e8-859f-2a38100605f4.jpg)

-----------
[@MikeTheWatchGuy](https://github.com/MikeTheWatchGuy) 11/18/2018 16:54:32

![lidar gui](https://user-images.githubusercontent.com/13696193/48675586-a8eb1d00-eb28-11e8-9c7a-a479d7b45d9c.png)

-----------
[@eagleEggs](https://github.com/eagleEggs) 11/16/2018 03:08:43

![image](https://user-images.githubusercontent.com/29800532/48595428-91dade00-e922-11e8-982b-d65539549124.png)

![image](https://user-images.githubusercontent.com/29800532/48596360-ba64d700-e926-11e8-9545-3c1edef65d10.png)

![image](https://user-images.githubusercontent.com/29800532/48596375-c81a5c80-e926-11e8-9968-a632b43069e5.png)

-----------
[@eagleEggs](https://github.com/eagleEggs) 11/12/2018 17:58:27

![image](https://user-images.githubusercontent.com/29800532/48366002-8cf40100-e67a-11e8-8f68-d95e539e254c.png)

![image](https://user-images.githubusercontent.com/29800532/48366144-f116c500-e67a-11e8-8669-8c0abdd02298.png)

-----------
[@john144](https://github.com/john144) 11/04/2018 03:03:06

![2018-11-03 21_19_10-description file query](https://user-images.githubusercontent.com/6464098/47959296-2e5dc180-dfae-11e8-8f1e-9d263a6d8d14.png)

-----------
[@eagleEggs](https://github.com/eagleEggs) 11/04/2018 00:22:20

![image](https://user-images.githubusercontent.com/29800532/47958669-1aae5d00-dfa6-11e8-8f61-b8244488040d.png)

-----------
[@AltoRetrato](https://github.com/AltoRetrato) 10/29/2018 17:45:47

![tree_256](https://user-images.githubusercontent.com/22997468/47669247-420dc000-db89-11e8-8999-d2c509320fd5.png)

-----------
[@iris-chang](https://github.com/iris-chang) 10/24/2018 07:04:44

![image](https://user-images.githubusercontent.com/12161426/47411983-5460b600-d7a5-11e8-98b6-961113b0b050.png)

-----------
[@MikeTheWatchGuy](https://github.com/MikeTheWatchGuy) 10/03/2018 21:54:34

![floating menu-toolbar](https://user-images.githubusercontent.com/13696193/46441704-59e25780-c735-11e8-8d94-9884a4e7c987.jpg)

-----------
[@eagleEggs](https://github.com/eagleEggs) 10/02/2018 20:18:39

![image](https://user-images.githubusercontent.com/29800532/46385695-7924aa80-c68b-11e8-9ecc-c8a5afdad61d.png)

-----------
[@eagleEggs](https://github.com/eagleEggs) 09/30/2018 21:37:08

![image](https://user-images.githubusercontent.com/29800532/46262855-5fd9fd80-c4d5-11e8-8664-f094f2149105.png)

![image](https://user-images.githubusercontent.com/29800532/46262858-71bba080-c4d5-11e8-9ea3-2e55b793aff6.png)

![image](https://user-images.githubusercontent.com/29800532/46262860-7a13db80-c4d5-11e8-9b41-87e9444ff3d8.png)

![image](https://user-images.githubusercontent.com/29800532/46262911-21910e00-c4d6-11e8-84f8-30881ff3a581.png)

![image](https://user-images.githubusercontent.com/29800532/46262862-80a25300-c4d5-11e8-8553-d6e6b52c64ae.png)

![image](https://user-images.githubusercontent.com/29800532/46262864-86983400-c4d5-11e8-9735-168df6ae55ec.png)

![image](https://user-images.githubusercontent.com/29800532/46262865-8e57d880-c4d5-11e8-9a98-de8c73b4648c.png)

-----------
[@MikeTheWatchGuy](https://github.com/MikeTheWatchGuy) 09/16/2018 21:26:51

![calculator](https://user-images.githubusercontent.com/13696193/45601112-b0316580-b9d5-11e8-9f42-38acdfd5db93.jpg)

-----------
